Date,Channel,Duration,Language,Translated,Text,Filename,
2026-03-31T07:04:30Z,ORION MER MANAGER,00:15,en,"","Daily priorities: docking rehearsal, EVA prep review, comms continuity.",A2_0331_070430.wav,
2026-03-31T09:49:59Z,EVA,00:23,en,"","Suit telemetry channel B had short outage,
restored after connector reseat. No timeline slip.",A2_0331_094959.wav,
2026-03-31T12:18:00Z,COMMS,00:18,en,"","Cross-support station confirms margin for next handover pass.",A2_0331_121800.wav,
2026-03-31T14:52:45Z,FLIGHT,00:22,en,"","Proceeding with rehearsal complete call. Risk posture remains green.",A2_0331_145245.wav,
